[
  {
    "active": true,
    "category": null,
    "city": null,
    "company_id": "ef3e9841-d564-441c-9ec5-328b7566457e",
    "company_name": "Orca Aerospace",
    "country": null,
    "date_posted": "2026-10-23T05:21:28.408355+00:00",
    "department": null,
    "education": null,
    "experience_max": null,
    "experience_min": null,
    "first_seen": "2026-10-23T05:21:28.569617+00:00",
    "id": "rl_c7630678ef002486efcc8d79",
    "last_seen": "2026-10-23T05:21:28.569617+00:00",
    "location": null,
    "location_type": "Remote",
    "remote": true,
    "required_skills": [],
    "salary_currency": null,
    "salary_max": null,
    "salary_min": null,
    "salary_range": null,
    "seniority": "Mid",
    "source_platform": "ycombinator",
    "subcategory": null,
    "tech_stack": [],
    "title": "Founding Flight Software Engineer",
    "title_simplified": null,
    "url": "https://www.ycombinator.com/companies/orca-aerospace/jobs/eMihWDs-founding-flight-software-engineer",
    "visa_sponsorship": null
  },
  {
    "active": true,
    "category": null,
    "city": null,
    "company_id": "ff33c080-1300-4582-ba99-1dfc315493fe",
    "company_name": "Ignition Benefits",
    "country": null,
    "date_posted": "2026-10-23T05:21:28.26961+00:00",
    "department": null,
    "education": null,
    "experience_max": null,
    "experience_min": null,
    "first_seen": "2026-10-23T05:21:28.569617+00:00",
    "id": "rl_f21f88a2c5d82d2dca071e6d",
    "last_seen": "2026-10-23T05:21:28.569617+00:00",
    "location": null,
    "location_type": "On-site",
    "remote": false,
    "required_skills": [],
    "salary_currency": null,
    "salary_max": null,
    "salary_min": null,
    "salary_range": null,
    "seniority": "Mid",
    "source_platform": "ycombinator",
    "subcategory": null,
    "tech_stack": [],
    "title": "Founding Member of Technical Staff",
    "title_simplified": null,
    "url": "https://www.ycombinator.com/companies/ignition-benefits/jobs/04TOkxY-founding-member-of-technical-staff",
    "visa_sponsorship": null
  },
  {
    "active": true,
    "category": null,
    "city": null,
    "company_id": "a089b5ef-11dd-442c-9288-b12075029066",
    "company_name": "The Subvocal Company",
    "country": null,
    "date_posted": "2026-10-23T05:21:28.228537+00:00",
    "department": null,
    "education": null,
    "experience_max": null,
    "experience_min": null,
    "first_seen": "2026-10-23T05:21:28.569617+00:00",
    "id": "rl_ae2ab8b650a5258942e49657",
    "last_seen": "2026-10-23T05:21:28.569617+00:00",
    "location": null,
    "location_type": "On-site",
    "remote": false,
    "required_skills": [],
    "salary_currency": null,
    "salary_max": null,
    "salary_min": null,
    "salary_range": null,
    "seniority": "Mid",
    "source_platform": "ycombinator",
    "subcategory": null,
    "tech_stack": [],
    "title": "Head of ML",
    "title_simplified": null,
    "url": "https://www.ycombinator.com/companies/the-subvocal-company/jobs/RzUITdx-head-of-ml",
    "visa_sponsorship": null
  },
  {
    "active": true,
    "category": null,
    "city": null,
    "company_id": "a089b5ef-11dd-442c-9288-b12075029066",
    "company_name": "The Subvocal Company",
    "country": null,
    "date_posted": "2026-10-23T05:21:28.228517+00:00",
    "department": null,
    "education": null,
    "experience_max": null,
    "experience_min": null,
    "first_seen": "2026-10-23T05:21:28.569617+00:00",
    "id": "rl_03623fa8549c25b1fdacfb6a",
    "last_seen": "2026-10-23T05:21:28.569617+00:00",
    "location": null,
    "location_type": "On-site",
    "remote": false,
    "required_skills": [],
    "salary_currency": null,
    "salary_max": null,
    "salary_min": null,
    "salary_range": null,
    "seniority": "Mid",
    "source_platform": "ycombinator",
    "subcategory": null,
    "tech_stack": [],
    "title": "Head of Sensing",
    "title_simplified": null,
    "url": "https://www.ycombinator.com/companies/the-subvocal-company/jobs/yBCprPW-head-of-sensing",
    "visa_sponsorship": null
  },
  {
    "active": true,
    "category": null,
    "city": null,
    "company_id": "a089b5ef-11dd-442c-9288-b12075029066",
    "company_name": "The Subvocal Company",
    "country": null,
    "date_posted": "2026-10-23T05:21:28.22848+00:00",
    "department": null,
    "education": null,
    "experience_max": null,
    "experience_min": null,
    "first_seen": "2026-10-23T05:21:28.569617+00:00",
    "id": "rl_7d36468b67cd874531b4b867",
    "last_seen": "2026-10-23T05:21:28.569617+00:00",
    "location": null,
    "location_type": "On-site",
    "remote": false,
    "required_skills": [],
    "salary_currency": null,
    "salary_max": null,
    "salary_min": null,
    "salary_range": null,
    "seniority": "Mid",
    "source_platform": "ycombinator",
    "subcategory": null,
    "tech_stack": [],
    "title": "Head of Hardware",
    "title_simplified": null,
    "url": "https://www.ycombinator.com/companies/the-subvocal-company/jobs/XEN2HGf-head-of-hardware",
    "visa_sponsorship": null
  },
  {
    "active": true,
    "category": null,
    "city": null,
    "company_id": "ada5acd8-b0ac-4b97-8503-f199c4870d33",
    "company_name": "Workers IO",
    "country": null,
    "date_posted": "2026-10-23T05:21:28.186116+00:00",
    "department": null,
    "education": null,
    "experience_max": null,
    "experience_min": null,
    "first_seen": "2026-10-23T05:21:28.569617+00:00",
    "id": "rl_3850ee27edec5e61df9dbd9d",
    "last_seen": "2026-10-23T05:21:28.569617+00:00",
    "location": null,
    "location_type": "Remote",
    "remote": true,
    "required_skills": [],
    "salary_currency": null,
    "salary_max": null,
    "salary_min": null,
    "salary_range": null,
    "seniority": "Mid",
    "source_platform": "ycombinator",
    "subcategory": null,
    "tech_stack": [],
    "title": "Systems Engineer, Hypervisor and Kernel",
    "title_simplified": null,
    "url": "https://www.ycombinator.com/companies/workers-io/jobs/UV8iE3b-systems-engineer-hypervisor-and-kernel",
    "visa_sponsorship": null
  },
  {
    "active": true,
    "category": null,
    "city": null,
    "company_id": "05713457-b083-44e7-91dc-099b46424055",
    "company_name": "Runtime.si",
    "country": null,
    "date_posted": "2026-10-23T05:21:27.148026+00:00",
    "department": null,
    "education": null,
    "experience_max": null,
    "experience_min": null,
    "first_seen": "2026-10-23T05:21:27.362608+00:00",
    "id": "rl_c49f6db264d80fe6c7187023",
    "last_seen": "2026-10-23T05:21:27.362608+00:00",
    "location": null,
    "location_type": "On-site",
    "remote": false,
    "required_skills": [],
    "salary_currency": null,
    "salary_max": null,
    "salary_min": null,
    "salary_range": null,
    "seniority": "Mid",
    "source_platform": "ycombinator",
    "subcategory": null,
    "tech_stack": [],
    "title": "Mechatronics Engineer",
    "title_simplified": null,
    "url": "https://www.ycombinator.com/companies/runtimesi/jobs/MzXnOwU-mechatronics-engineer",
    "visa_sponsorship": null
  },
  {
    "active": true,
    "category": null,
    "city": null,
    "company_id": "05713457-b083-44e7-91dc-099b46424055",
    "company_name": "Runtime.si",
    "country": null,
    "date_posted": "2026-10-23T05:21:27.148011+00:00",
    "department": null,
    "education": null,
    "experience_max": null,
    "experience_min": null,
    "first_seen": "2026-10-23T05:21:27.362608+00:00",
    "id": "rl_78548012d08aae9237a06905",
    "last_seen": "2026-10-23T05:21:27.362608+00:00",
    "location": null,
    "location_type": "On-site",
    "remote": false,
    "required_skills": [],
    "salary_currency": null,
    "salary_max": null,
    "salary_min": null,
    "salary_range": null,
    "seniority": "Mid",
    "source_platform": "ycombinator",
    "subcategory": null,
    "tech_stack": [],
    "title": "Electrical Engineer, Robotics",
    "title_simplified": null,
    "url": "https://www.ycombinator.com/companies/runtimesi/jobs/CFyIFbn-electrical-engineer-robotics",
    "visa_sponsorship": null
  },
  {
    "active": true,
    "category": null,
    "city": null,
    "company_id": "05713457-b083-44e7-91dc-099b46424055",
    "company_name": "Runtime.si",
    "country": null,
    "date_posted": "2026-10-23T05:21:27.147992+00:00",
    "department": null,
    "education": null,
    "experience_max": null,
    "experience_min": null,
    "first_seen": "2026-10-23T05:21:27.362608+00:00",
    "id": "rl_fc6d8503229488817b016cde",
    "last_seen": "2026-10-23T05:21:27.362608+00:00",
    "location": null,
    "location_type": "On-site",
    "remote": false,
    "required_skills": [],
    "salary_currency": null,
    "salary_max": null,
    "salary_min": null,
    "salary_range": null,
    "seniority": "Mid",
    "source_platform": "ycombinator",
    "subcategory": null,
    "tech_stack": [],
    "title": "Founding Software Engineer, Robotics Infrastructure",
    "title_simplified": null,
    "url": "https://www.ycombinator.com/companies/runtimesi/jobs/0oIw1pj-founding-software-engineer-robotics-infrastructure",
    "visa_sponsorship": null
  },
  {
    "active": true,
    "category": null,
    "city": null,
    "company_id": "05713457-b083-44e7-91dc-099b46424055",
    "company_name": "Runtime.si",
    "country": null,
    "date_posted": "2026-10-23T05:21:27.147952+00:00",
    "department": null,
    "education": null,
    "experience_max": null,
    "experience_min": null,
    "first_seen": "2026-10-23T05:21:27.362608+00:00",
    "id": "rl_4e39930a4b2459782475d953",
    "last_seen": "2026-10-23T05:21:27.362608+00:00",
    "location": null,
    "location_type": "On-site",
    "remote": false,
    "required_skills": [],
    "salary_currency": null,
    "salary_max": null,
    "salary_min": null,
    "salary_range": null,
    "seniority": "Mid",
    "source_platform": "ycombinator",
    "subcategory": null,
    "tech_stack": [],
    "title": "Founding GTM",